judul,kategori
"Bank Indonesia naikkan suku bunga acuan menjadi 6 persen",ekonomi
"Presiden lantik menteri kabinet baru",politik
"Film Indonesia raih penghargaan di festival internasional",hiburan
"Peluncuran smartphone flagship dengan teknologi AI terbaru",teknologi
"Tim nasional lolos ke babak final Piala Dunia",olahraga
"Harga minyak dunia turun drastis",ekonomi
"DPR sahkan RUU tentang ibu kota negara",politik
"Konser musik K-Pop dihadiri 50 ribu penonton",hiburan
"Startup teknologi raih pendanaan seri B senilai 50 juta dolar",teknologi
"Atlet Indonesia pecahkan rekor dunia angkat besi",olahraga
"Inflasi bulanan naik 0.5 persen",ekonomi
"Pemilu kepala daerah serentak akan digelar tahun depan",politik
"Serial drama televisi raih rating tertinggi",hiburan
"Kecerdasan buatan mampu deteksi penyakit dari foto sinar-X",teknologi
"Kejuaraan bulu tangkis internasional dimulai pekan ini",olahraga
"Nilai tukar rupiah menguat terhadap dolar AS",ekonomi
"Menteri luar negeri kunjungi lima negara ASEAN",politik
"Penyanyi pop rilis album terbaru setelah hiatus dua tahun",hiburan
"Jaringan 5G diperluas ke 100 kota di Indonesia",teknologi
"Pembalap Indonesia juara di ajang MotoGP",olahraga
"Bursa saham ditutup menguat 2 persen",ekonomi
"Pemerintah umumkan kebijakan subsidi energi baru",politik
"Festival film dokumenter tampilkan 50 karya pilihan",hiburan
"Robot AI mulai digunakan di rumah sakit untuk bantu tenaga medis",teknologi
"Liga sepak bola domestik masuki babak semifinal",olahraga
"Ekspor komoditas pertanian meningkat 25 persen",ekonomi
"Debat calon presiden akan disiarkan langsung di televisi nasional",politik
"Aktor ternama raih penghargaan lifetime achievement",hiburan
"Aplikasi berbasis blockchain untuk keamanan data diluncurkan",teknologi
"Atlet renang Indonesia sabet medali emas di SEA Games",olahraga
"Penjualan ritel naik signifikan jelang akhir tahun",ekonomi
"Sidang kasus korupsi mantan pejabat dimulai hari ini",politik
"MusikFest Jakarta hadirkan 30 musisi dari berbagai genre",hiburan
"Teknologi quantum computing mulai diuji coba di universitas",teknologi
"Tim voli putri Indonesia kalahkan juara bertahan",olahraga
"Harga emas antam naik Rp10.000 per gram",ekonomi
"Partai politik gelar kongres nasional untuk pilih ketua umum baru",politik
"Reality show pencarian bakat tayang perdana malam ini",hiburan
"Satelit komunikasi buatan dalam negeri berhasil diluncurkan",teknologi
"Turnamen tenis terbuka Indonesia dibuka oleh menteri pemuda dan olahraga",olahraga
"Pertumbuhan ekonomi kuartal ketiga capai 5.3 persen",ekonomi
"Rapat paripurna DPR bahas anggaran pendidikan",politik
"Band legendaris umumkan tur reuni setelah 10 tahun vakum",hiburan
"Drone pengiriman paket mulai diuji di beberapa kota besar",teknologi
"Petinju nasional bertahan sebagai juara dunia kelas berat",olahraga
"Pemerintah turunkan harga BBM subsidi",ekonomi
"Wakil presiden hadiri KTT perubahan iklim",politik
"Platform streaming lokal luncurkan konten original series",hiburan
"Mobil listrik produksi lokal siap dipasarkan tahun depan",teknologi
"Kompetisi eSports tingkat nasional hadiah miliaran rupiah",olahraga
"Kementerian keuangan terbitkan obligasi negara seri baru",ekonomi
"Mahkamah konstitusi putuskan sengketa pemilu daerah",politik
"Sutradara muda Indonesia film pendeknya masuk nominasi Oscar",hiburan
"Teknologi pengenalan wajah diterapkan di bandara internasional",teknologi
"Pelatih timnas mengundurkan diri setelah kekalahan beruntun",olahraga
"Indeks harga saham gabungan tembus level 7000",ekonomi
"Menteri koordinator bidang politik gelar rapat koordinasi",politik
"Penghargaan musik Indonesia umumkan nominasi tahun ini",hiburan
"Perusahaan teknologi buka pusat riset AI di Jakarta",teknologi
"Pemain sepak bola muda dipanggil ke tim nasional senior",olahraga
"Bank sentral pertahankan suku bunga di level 5.75 persen",ekonomi
"Komisi pemberantasan korupsi tangkap pejabat daerah",politik
"Film horor Indonesia pecahkan rekor penonton",hiburan
"Laptop gaming dengan prosesor generasi terbaru diluncurkan",teknologi
"Atlet panjat tebing raih emas di kejuaraan Asia",olahraga
"Harga komoditas pangan stabil menjelang lebaran",ekonomi
"Pemerintah daerah usulkan revisi peraturan daerah",politik
"Konser amal untuk korban bencana kumpulkan miliaran rupiah",hiburan
"Teknologi AR dan VR mulai digunakan dalam pendidikan",teknologi
"Klub sepak bola lokal rekrut pemain asing bintang",olahraga
"Defisit anggaran negara diprediksi menurun tahun ini",ekonomi
"Senator terpilih dilantik di gedung parlemen",politik
"Acara penghargaan film asia digelar di Bali",hiburan
"Chipset smartphone terbaru klaim hemat baterai 40 persen",teknologi
"Tim basket nasional lolos ke olimpiade setelah 20 tahun",olahraga
"Penjualan properti residensial meningkat kuartal ini",ekonomi
"Perdana menteri negara tetangga kunjungi Indonesia",politik
"Musisi jazz internasional akan konser di Jakarta",hiburan
"Teknologi deepfake detector dikembangkan peneliti lokal",teknologi
"Pesepeda Indonesia juara tour de Asia",olahraga
"Cadangan devisa Indonesia capai 150 miliar dolar AS",ekonomi
"Menteri dalam negeri evaluasi kinerja gubernur se-Indonesia",politik
"Serial animasi Indonesia tayang di platform internasional",hiburan
"Perusahaan fintech raih lisensi dari OJK",teknologi
"Stadion baru berkapasitas 80 ribu penonton diresmikan",olahraga
"Pemerintah naikkan upah minimum regional 8 persen",ekonomi
"Reformasi birokrasi dimulai di kementerian dan lembaga",politik
"Festival musik elektronik hadirkan DJ kelas dunia",hiburan
"Teknologi charging nirkabel jarak jauh mulai dikomersialisasi",teknologi
"Atlet triathlon Indonesia pecahkan rekor nasional",olahraga
"Pajak karbon akan diterapkan mulai tahun depan",ekonomi
"Undang-undang cipta kerja direvisi sesuai putusan MK",politik
"Penyanyi dangdut legendaris akan gelar konser perpisahan",hiburan
"Supercomputer pertama buatan Indonesia diresmikan",teknologi
"Tim dayung raih medali perunggu di kejuaraan dunia",olahraga
"Investasi asing langsung naik 15 persen kuartal ini",ekonomi
"Presiden hadiri peringatan hari kemerdekaan negara sahabat",politik
"Bioskop multipleks baru dibuka di pusat perbelanjaan",hiburan
"Teknologi battery swap untuk kendaraan listrik diluncurkan",teknologi
"Atlet pencak silat borong 5 emas di SEA Games",olahraga
"Neraca perdagangan surplus 3 miliar dolar AS bulan ini",ekonomi
"Menteri pendidikan luncurkan kurikulum baru",politik
"Penyanyi Indonesia kolaborasi dengan artis Hollywood",hiburan
"Startup edtech raih pendanaan 20 juta dolar",teknologi
"Pemain tenis meja Indonesia juara grand final",olahraga
"Harga saham perusahaan teknologi meroket 50 persen",ekonomi
"Rapat kabinet bahas program prioritas nasional",politik
"Drama musikal adaptasi novel laris dipentaskan",hiburan
"Teknologi solar panel transparan untuk jendela gedung",teknologi
"Atlet gimnastik raih nilai sempurna di kompetisi",olahraga
"Bank digital raih nasabah 10 juta dalam setahun",ekonomi
"Komisi pemilihan umum tetapkan daftar pemilih tetap",politik
"Aktor muda raih piala citra sutradara terbaik",hiburan
"Perusahaan game lokal ekspansi ke pasar global",teknologi
"Kejuaraan tinju internasional digelar di Jakarta",olahraga
"Pemerintah targetkan pertumbuhan ekonomi 6 persen",ekonomi
"Menteri kesehatan laporkan penurunan kasus penyakit menular",politik
"Festival teater internasional tampilkan 20 pertunjukan",hiburan
"Teknologi hologram interaktif digunakan di mall",teknologi
"Pemain catur Indonesia jadi grand master termuda",olahraga
"Kredit perbankan tumbuh 12 persen year on year",ekonomi
"Pemerintah bentuk satuan tugas khusus tangani inflasi",politik
"Komika Indonesia tampil di acara stand up comedy Amerika",hiburan
"Robot humanoid buatan lokal dipamerkan di pameran teknologi",teknologi
"Atlet panahan raih emas di kejuaraan dunia indoor",olahraga
"Ekspor tekstil Indonesia tembus pasar Eropa",ekonomi
"DPR setujui anggaran kesehatan naik 20 persen",politik
"Sinetron religi raih rating tertinggi di bulan Ramadan",hiburan
"Teknologi IoT untuk smart city diterapkan di 10 kota",teknologi
"Tim futsal Indonesia juara AFF championship",olahraga
"Nilai ekspor non migas naik signifikan",ekonomi
"Pemilihan ketua umum partai digelar secara demokratis",politik
"Konser reunion band 90-an sold out dalam 2 jam",hiburan
"Aplikasi kesehatan berbasis AI capai 5 juta pengguna",teknologi
"Atlet karate raih medali di kejuaraan Eropa",olahraga
"Otoritas pajak kejar target penerimaan tahun ini",ekonomi
"Menteri BUMN rombak direksi beberapa perusahaan plat merah",politik
"Film dokumenter Indonesia tayang di Netflix",hiburan
"Teknologi face payment mulai digunakan di retail modern",teknologi
"Pembalap muda Indonesia juara Asia Talent Cup",olahraga
"Harga beras stabil di seluruh wilayah Indonesia",ekonomi
"Pemerintah gandeng swasta bangun infrastruktur strategis",politik
"Penyanyi Indonesia masuk nominasi MTV Awards",hiburan
"Drone pertanian dengan AI bantu petani tingkatkan hasil panen",teknologi
"Atlet selancar air raih juara dunia untuk pertama kali",olahraga
"Indeks kepercayaan konsumen meningkat di kuartal ketiga",ekonomi
"Jaksa agung dilantik setelah fit and proper test DPR",politik
"Produser musik Indonesia garap soundtrack film Hollywood",hiburan
"Teknologi voice assistant bahasa Indonesia diluncurkan",teknologi
"Tim polo air putri Indonesia juara Asia Tenggara",olahraga
"Pemerintah salurkan bantuan modal usaha UMKM",ekonomi
"Menteri agraria percepat program sertifikasi tanah",politik
"Presenter terkenal rilis buku autobiografi",hiburan
"Perusahaan e-commerce luncurkan fitur live shopping",teknologi
"Atlet lari marathon Indonesia pecahkan rekor nasional",olahraga
"Transaksi digital payment naik 300 persen dalam 3 tahun",ekonomi
"Komisi III DPR panggil kapolri bahas kasus terorisme",politik
"Serial web original produksi lokal tembus 100 juta viewers",hiburan
"Teknologi neural network untuk diagnosa medis diuji klinis",teknologi
"Pemain golf Indonesia juara turnamen PGA Asia",olahraga
"Investor asing beli obligasi pemerintah senilai 50 triliun",ekonomi
"Presiden tunjuk duta besar baru untuk PBB",politik
"Penyanyi dangdut raih triple platinum untuk album terbaru",hiburan
"Startup agritech kembangkan sensor tanah pintar",teknologi
"Kejuaraan atletik nasional pecahkan 15 rekor",olahraga
"Industri pariwisata pulih 80 persen pasca pandemi",ekonomi
"Menteri pertahanan kunjungi pangkalan militer di perbatasan",politik
"Film animasi Indonesia raih Best Animation Asia Pacific",hiburan
"Teknologi wireless charging untuk mobil listrik diperkenalkan",teknologi
"Atlet anggar remaja wakili Indonesia di olimpiade remaja",olahraga
"Dana pensiun negara raih return investasi 15 persen",ekonomi
"Pemilihan gubernur DKI Jakarta akan digelar tahun depan",politik
"Musisi indie Indonesia tur keliling Eropa",hiburan
"Perusahaan teknologi buka bootcamp coding gratis",teknologi
"Tim esports Indonesia juara Mobile Legends Southeast Asia Cup",olahraga
"Penjualan mobil listrik naik 200 persen tahun ini",ekonomi
"Menteri sosial salurkan bantuan untuk korban banjir",politik
"Acara award musik Indonesia digelar megah di Bali",hiburan
"Teknologi biodegradable plastic dari singkong dikembangkan",teknologi
"Atlet taekwondo raih emas di Asian Games",olahraga
"Koperasi simpan pinjam salurkan kredit UMKM 10 triliun",ekonomi
"Pemerintah teken MoU kerjasama ekonomi dengan negara G20",politik
"Sutradara perempuan Indonesia raih penghargaan internasional",hiburan
"Aplikasi transportasi online tambah fitur keamanan berbasis AI",teknologi
"Pemain bulutangkis ganda campuran juara All England",olahraga
"Produk ekspor furniture Indonesia laris di pasar global",ekonomi
"Menteri hukum dan HAM luncurkan sistem pelayanan publik digital",politik
"Konser musik jazz internasional di Borobudur",hiburan
"Teknologi vertical farming mulai diterapkan di perkotaan",teknologi
"Atlet menembak raih medali di kejuaraan dunia",olahraga
"Daya beli masyarakat meningkat seiring perbaikan ekonomi",ekonomi
"Sidang tahunan MPR bahas amandemen UUD 1945",politik
"Rapper Indonesia kolaborasi dengan rapper Korea",hiburan
"Startup logistik raih unicorn status",teknologi
"Tim sepak bola U-19 juara Piala AFF",olahraga
"Impor bahan baku industri meningkat dukung produksi",ekonomi
"Menteri kelautan dan perikanan canangkan program ketahanan pangan laut",politik
"Festival seni pertunjukan tradisional hadirkan seniman nusantara",hiburan
"Teknologi pengolahan sampah jadi energi listrik dikembangkan",teknologi
"Atlet skateboard Indonesia wakili Asia di X Games",olahraga
"Perusahaan asuransi bayar klaim 5 triliun tahun lalu",ekonomi
"Kepala staf kepresidenan sampaikan arahan presiden ke menteri",politik
"Film biografi tokoh nasional akan tayang akhir tahun",hiburan
"Perusahaan teknologi luncurkan laptop dengan layar lipat",teknologi
"Kejuaraan balap sepeda Indonesia diikuti 500 peserta",olahraga
"Sektor konstruksi tumbuh 8 persen didorong proyek infrastruktur",ekonomi
"Gubernur se-Indonesia rapat koordinasi dengan Kemendagri",politik
"Pelantun lagu viral raih kontrak rekaman major label",hiburan
"Teknologi smart mirror untuk fashion try-on diluncurkan",teknologi
"Tim hoki Indonesia raih perak di kejuaraan Asia",olahraga
"Pemerintah gelontorkan stimulus ekonomi 150 triliun",ekonomi
"Menteri ketenagakerjaan tingkatkan program pelatihan vokasi",politik
"Komposer muda Indonesia ciptakan soundtrack game internasional",hiburan
"Startup healthtech luncurkan telemedicine 24 jam",teknologi
"Atlet layar Indonesia juara kejuaraan dunia junior",olahraga
"Realisasi investasi tahun ini diprediksi lampaui target",ekonomi
"DPR tetapkan APBN tahun depan fokus pada pembangunan SDM",politik
"Acara talent show menyanyi raih rating fantastis",hiburan
"Teknologi desalinasi air laut skala besar dibangun",teknologi
"Pemain biliar Indonesia juara dunia 9-ball",olahraga
"Kementerian BUMN optimis capai laba Rp500 triliun",ekonomi
"Presiden terima kunjungan kepala negara Jerman",politik
"Penyanyi Indonesia akan tampil di Coachella Festival",hiburan
"Perusahaan teknologi kembangkan chip AI buatan lokal",teknologi
"Tim sepak takraw putra juara King's Cup Thailand",olahraga
"Bursa berjangka komoditas catat transaksi rekor",ekonomi
"Menteri komunikasi dan informatika berantas konten negatif",politik
"Serial komedi situasi Indonesia remake dari sitcom AS",hiburan
"Teknologi blockchain untuk supply chain management diterapkan",teknologi
"Atlet sofbol putri Indonesia lolos olimpiade",olahraga
"Kadin Indonesia gelar dialog dengan pelaku usaha",ekonomi
"Menteri pariwisata promosikan 10 destinasi prioritas",politik
"Youtuber Indonesia capai 20 juta subscribers",hiburan
"Startup fintech luncurkan kartu kredit digital tanpa biaya admin",teknologi
"Kejuaraan bola voli pantai internasional di Bali",olahraga
"Indeks manufaktur Indonesia memasuki zona ekspansi",ekonomi
"Komisi II DPR gelar hearing dengan kepala daerah",politik
"Konser tribute untuk musisi legendaris yang berpulang",hiburan
"Teknologi gesture control untuk smart home diluncurkan",teknologi
"Atlet judo raih medali emas di grand slam",olahraga
"Bank Indonesia optimis inflasi terkendali akhir tahun",ekonomi
"Menteri perdagangan perkuat diplomasi ekonomi bilateral",politik
"Produser film Indonesia garap proyek bersama Netflix",hiburan
"Teknologi thermal imaging untuk deteksi dini penyakit",teknologi
"Tim polo Indonesia juara Southeast Asian Water Polo Championship",olahraga
"Pemerintah tambah kuota impor daging untuk stabilkan harga",ekonomi
"Ketua DPR terima kunjungan delegasi parlemen negara sahabat",politik
"Festival tari kontemporer hadirkan koreografer internasional",hiburan
"Perusahaan teknologi luncurkan earbuds dengan noise cancelling adaptif",teknologi
"Atlet squash Indonesia raih juara Asian Games",olahraga
"Holding BUMN pertambangan resmi dibentuk",ekonomi
"Menteri lingkungan hidup luncurkan program penghijauan nasional",politik
"Film Indonesia masuk seleksi Festival Cannes",hiburan
"Teknologi smart grid untuk distribusi listrik lebih efisien",teknologi
"Pemain tenis Indonesia masuk peringkat 50 besar dunia",olahraga
"OJK catat pertumbuhan industri keuangan non-bank 18 persen",ekonomi
"Pemerintah daerah terapkan aplikasi perizinan online",politik
"Konser musik klasik orkes simfoni Jakarta di teater megah",hiburan
"Startup edukasi luncurkan platform belajar dengan AI tutor",teknologi
"Atlet wushu Indonesia dominasi kejuaraan Asia Tenggara",olahraga
"Penjualan semen nasional naik sejalan pembangunan infrastruktur",ekonomi
"Menteri agraria selesaikan konflik lahan di berbagai daerah",politik
"Peluncuran film superhero Indonesia dengan CGI berkualitas",hiburan
"Teknologi predictive maintenance untuk pabrik berbasis sensor IoT",teknologi
"Kejuaraan renang nasional cetak 20 rekor baru",olahraga
"Ekspor produk kreatif Indonesia tembus 2 miliar dolar",ekonomi
"Presiden buka sidang kabinet paripurna evaluasi kinerja",politik
"Penata musik Indonesia raih Grammy nomination",hiburan
"Perusahaan teknologi luncurkan smart watch dengan ECG monitor",teknologi
"Tim basket 3x3 Indonesia juara FIBA Asia Cup",olahraga
"Pemerintah siapkan insentif pajak untuk industri ramah lingkungan",ekonomi
"Menteri desa bangun 10000 desa digital",politik
"Serial drama Korea versi remake Indonesia tayang perdana",hiburan
"Teknologi carbon capture and storage diuji di pabrik semen",teknologi
"Atlet sepeda BMX Indonesia juara Asian Championship",olahraga
"Investasi sektor properti meningkat di kuartal kedua",ekonomi
"Komisi I DPR bahas pengadaan alutsista TNI",politik
"Penyanyi Indonesia jadi brand ambassador merek fashion global",hiburan
"Startup teknologi pertanian raih penghargaan inovasi",teknologi
"Kejuaraan panjat tebing Asia digelar di Indonesia",olahraga
"Kementerian keuangan terbitkan sukuk ritel untuk infrastruktur",ekonomi
"Menteri koordinator bidang maritim bahas tol laut",politik
"Film horor Indonesia remake dari film klasik 80-an",hiburan
"Teknologi wireless power transmission untuk device charging",teknologi
"Atlet berkuda Indonesia raih medali di SEA Games",olahraga
"Cadangan pangan beras nasional aman hingga 6 bulan ke depan",ekonomi
"Pemerintah revisi aturan tentang tenaga kerja asing",politik
"Festival film pendek internasional digelar di Yogyakarta",hiburan
"Perusahaan teknologi luncurkan sistem operasi mobile buatan lokal",teknologi
"Tim rugby Indonesia juara Asia Sevens Series",olahraga
"Lembaga penjamin simpanan tingkatkan program edukasi nasabah",ekonomi
"Menteri pemberdayaan perempuan luncurkan program anti kekerasan",politik
"Penari kontemporer Indonesia tampil di New York",hiburan
"Teknologi autonomous underwater vehicle untuk eksplorasi laut",teknologi
"Atlet angkat besi remaja pecahkan rekor dunia junior",olahraga
"Pemerintah subsidi bunga kredit usaha rakyat",ekonomi
"DPR gelar paripurna istimewa peringatan hari bersejarah",politik
"Konser musik indie festival hadirkan 50 band lokal",hiburan
"Startup mobility luncurkan skuter listrik sharing",teknologi
"Kejuaraan dayung internasional diikuti 30 negara",olahraga
"Harga cabai rawit turun 40 persen setelah panen raya",ekonomi
"Menteri agama luncurkan program moderasi beragama",politik
"Peluncuran album kolaborasi musisi lintas genre",hiburan
"Teknologi smart farming dengan drone monitoring tanaman",teknologi
"Atlet menembak Indonesia raih quota place olimpiade",olahraga
"Bank perkreditan rakyat salurkan kredit mikro 50 triliun",ekonomi
"Pemerintah bentuk tim khusus percepatan investasi",politik
"Film dokumenter tentang satwa langka Indonesia raih award",hiburan
"Perusahaan teknologi kembangkan kacamata AR untuk konsumen",teknologi
"Tim sepak bola pantai Indonesia juara ASEAN Beach Games",olahraga
"Pertamina temukan cadangan migas baru di Kalimantan",ekonomi
"Menteri perhubungan resmikan bandara baru di Papua",politik
"Penyanyi dangdut koplo viral kolaborasi dengan DJ EDM",hiburan
"Teknologi air purifier dengan UV-C dan HEPA filter diluncurkan",teknologi
"Atlet kano Indonesia raih medali di kejuaraan dunia",olahraga
"Penjualan online retail tumbuh 35 persen tahun ini",ekonomi
"Komisi IX DPR bahas jaminan kesehatan nasional",politik
"Festival musik dangdut terbesar se-Asia Tenggara",hiburan
"Startup proptech luncurkan platform jual beli properti digital",teknologi
"Kejuaraan senam artistik nasional lahirkan bibit atlet muda",olahraga
"Kementerian perdagangan buka akses pasar baru untuk ekspor",ekonomi
"Presiden lantik kepala badan intelijen negara yang baru",politik
"Sutradara Indonesia garap film di Hollywood",hiburan
"Teknologi biometric authentication untuk transaksi perbankan",teknologi
"Tim voli pantai putri Indonesia juara Asian Beach Games",olahraga
"Industri otomotif nasional produksi 1 juta unit tahun ini",ekonomi
"Menteri pendidikan tinggi dorong universitas masuk ranking dunia",politik
"Aktor Indonesia main film bareng aktor Hollywood",hiburan
"Perusahaan teknologi luncurkan smart home ecosystem terintegrasi",teknologi
"Atlet pencak silat raih emas di kejuaraan dunia Belanda",olahraga
"Pemerintah alokasikan dana desa 80 triliun tahun depan",ekonomi
"Menteri pemuda dan olahraga resmikan sport science center",politik
"Serial drama sejarah Indonesia produksi internasional",hiburan
"Teknologi neural interface untuk kontrol device dengan pikiran",teknologi
"Kejuaraan tinju remaja Asia digelar di Jakarta",olahraga
"Bank syariah merger jadi bank syariah terbesar di Indonesia",ekonomi
"DPR sahkan RUU tentang perlindungan data pribadi",politik
"Komposer Indonesia garap musik untuk film animasi Disney",hiburan
"Startup insurtech luncurkan asuransi mikro berbasis aplikasi",teknologi
"Atlet triathlon remaja Indonesia juara Asia Junior",olahraga
"Pemerintah bangun kawasan industri hijau di 5 provinsi",ekonomi
"Menteri luar negeri hadiri forum ekonomi dunia",politik
"Penyanyi jazz Indonesia tampil di Montreux Jazz Festival",hiburan
"Teknologi smart helmet dengan head-up display untuk pengendara",teknologi
"Tim balap perahu naga Indonesia juara kejuaraan internasional",olahraga
"Ekspor kopi Indonesia naik 25 persen ke pasar Eropa",ekonomi
"Presiden buka konferensi tingkat tinggi forum ekonomi",politik
"Festival film horor Indonesia tampilkan 30 film terbaik",hiburan
"Perusahaan teknologi kembangkan AI untuk prediksi cuaca akurat",teknologi
"Atlet lompat jauh Indonesia pecahkan rekor SEA Games",olahraga
"Kementerian ESDM dorong penggunaan energi terbarukan",ekonomi
"Menteri koperasi dan UKM luncurkan program digitalisasi UMKM",politik
"Penari balet Indonesia jadi principal dancer di New York",hiburan
"Teknologi holographic display 3D tanpa kacamata khusus",teknologi
"Kejuaraan gulat Asia digelar di Indonesia tahun depan",olahraga
"Nilai tukar rupiah stabil di tengah volatilitas global",ekonomi
"Pemerintah daerah terapkan smart city di 25 kota",politik
"Film musikal Indonesia raih box office terbaik tahun ini",hiburan
"Startup cybersecurity raih pendanaan 30 juta dolar",teknologi
"Atlet panahan compound Indonesia juara dunia",olahraga
"Harga komoditas sawit naik di pasar internasional",ekonomi
"Menteri komunikasi luncurkan satelit telekomunikasi",politik
"Penyanyi Indonesia kolaborasi dengan produser Grammy winner",hiburan
"Teknologi self-healing material untuk smartphone screen",teknologi
"Tim futsal putri Indonesia juara AFF",olahraga
"Penjualan obligasi korporasi mencapai rekor tertinggi",ekonomi
"DPR setujui ratifikasi perjanjian kerjasama internasional",politik
"Reality show memasak celebrity chef Indonesia rating tinggi",hiburan
"Perusahaan teknologi luncurkan router WiFi 7 generasi terbaru",teknologi
"Atlet sepeda trek Indonesia raih medali Asian Track Championship",olahraga
"Industri tekstil Indonesia ekspor ke 50 negara",ekonomi
"Menteri kesehatan luncurkan aplikasi rekam medis elektronik",politik
"Konser musik orkestra gamelan modern kolaborasi internasional",hiburan
"Teknologi smart ring untuk health monitoring diluncurkan",teknologi
"Kejuaraan pencak silat pelajar diikuti ribuan peserta",olahraga
"Jokowi resmikan jalan tol Trans Sumatera, menghubungkan tiga provinsi",Politik
"Presiden pimpin rapat terbatas evaluasi kinerja menteri di Istana Negara",Politik
"DPR sahkan RUU Ibu Kota Negara (IKN), proses pemindahan dimulai",Politik
"Mahfud MD umumkan hasil audit dana haji, ditemukan indikasi penyimpangan",Politik
"Survei Litbang Kompas: Elektabilitas Ganjar Pranowo unggul tipis dari Prabowo Subianto",Politik
"KPK tetapkan tiga anggota DPR sebagai tersangka kasus suap izin proyek",Politik
"Kepala BIN buka suara soal ancaman terorisme jelang pemilu 2024",Politik
"Pemerintah kaji ulang sistem proporsional terbuka dalam pemilihan legislatif",Politik
"PDI Perjuangan gelar Rakernas, fokus bahas strategi pemenangan",Politik
"Gubernur Jawa Barat Ridwan Kamil mundur dari jabatan, maju Pilpres 2024",Politik
"Menteri Pertahanan Prabowo Subianto teken kontrak alutsista baru dari Korea Selatan",Politik
"Sidang Paripurna DPR RI diwarnai interupsi panas antar fraksi",Politik
"Polisi bubarkan aksi demo buruh di depan gedung parlemen, ratusan diamankan",Politik
"Pemerintah resmi menaikkan harga BBM jenis Pertalite dan Solar",Politik
"Komisi III DPR panggil Kapolri soal penanganan kasus Tragedi Kanjuruhan",Politik
"Wacana perpanjangan masa jabatan Presiden tiga periode kembali mencuat",Politik
"Masyarakat sipil gugat Undang-Undang Cipta Kerja ke Mahkamah Konstitusi",Politik
"Juru bicara Presiden klarifikasi isu reshuffle kabinet, sebut hanya rotasi biasa",Politik
"Bupati nonaktif ditetapkan tersangka korupsi dana bantuan sosial COVID-19",Politik
"Jokowi tegaskan netralitas TNI-Polri di Pemilu, larang ikut politik praktis",Politik
"Fraksi PKS Walk Out dari rapat pembahasan APBN 2024",Politik
"Debat Capres kedua fokus pada isu lingkungan hidup dan sumber daya alam",Politik
"Menteri Agama Yaqut Cholil Qoumas luncurkan program moderasi beragama",Politik
"Ketua MPR Bambang Soesatyo dorong percepatan revisi UU Pemilu",Politik
"KPU umumkan daftar pemilih tetap (DPT) Pemilu 2024",Politik
